{
  "meta": {
    "kind": "release_validation_dependency_contract",
    "version": "v1",
    "authority": "reuse_invalidation_only_no_release_or_publication_authority",
    "description": "Central fail-closed disposition and semantic source-closure contract for release-proof execution reuse. It does not grant machine, human, release or publication authority."
  },
  "authorities": {
    "proof_steps": "config/release_proof_steps_contract.json",
    "proof_scope": "config/release_proof_scope_contract.json",
    "source_layers": "config/source_layer_taxonomy.json",
    "source_classification": "config/source_layer_classification_policy.json",
    "test_inventory": "config/distribution_test_profiles.json"
  },
  "diagnostic_test_unit_pilots": {
    "jsonc_parser": {
      "authority": "diagnostic_only_no_release_reuse",
      "canonical_profile_reuse_enabled": false,
      "test_path": "tools/tests/test_jsonc_parser.py",
      "review_digest_algorithm": "sha256_utf8_lf_v1",
      "expected_tests": [
        "test_jsonc_parser_preserves_alias_globs_and_comment_like_strings",
        "test_jsonc_parser_supports_block_comments_without_hiding_strings",
        "test_jsonc_parser_rejects_unterminated_block_comment",
        "test_jsonc_parser_accepts_one_utf8_bom"
      ],
      "reviewed_source_sha256": {
        "tools/tests/test_jsonc_parser.py": "c71710c5ae7adb686333e2bf337dda34ae64bd2d90b0e9e56a6f649bd54c0dce",
        "tools/core/jsonc.py": "b452e45c656f8992465ff98f0d50f9affb2df87e4f789213a105e6084c932168",
        "tools/__init__.py": "e3b0c44298fc1c149afbf4c8996fb92427ae41e4649b934ca495991b7852b855",
        "tools/core/__init__.py": "e3b0c44298fc1c149afbf4c8996fb92427ae41e4649b934ca495991b7852b855",
        "tools/tests/__init__.py": "01ba4719c80b6fe911b091a7c05124b64eeece964e09c058ef8f9805daca546b",
        "pyproject.toml": "4b8ea653db52ff022fe667fca4b2e4e2ae424aa3807feed3ec31a579bc1df0b0"
      },
      "required_absent_paths": [
        "pytest.ini",
        "setup.cfg",
        "tox.ini",
        "conftest.py",
        "tools/conftest.py",
        "tools/tests/conftest.py"
      ],
      "runtime_distributions": [
        "pytest",
        "pluggy",
        "packaging",
        "iniconfig",
        "pygments",
        "colorama"
      ],
      "timeout_seconds": 30
    }
  },
  "diagnostic_unit_output_observation": {
    "schema": "nexora_sage_diagnostic_unit_output_observation_v1",
    "authority": "diagnostic_only_no_test_or_release_admission",
    "protocol": "isolated_no_site_exact_env_closed_stdin_xunit2_v2",
    "digest_algorithm": "sha256_json_utf8_canonical_v1",
    "units": [
      "jsonc_parser"
    ],
    "limits": {
      "junit_bytes": 1048576,
      "xml_elements": 4096,
      "xml_depth": 16
    },
    "rationale": "Conservative operational refusal bounds for the four-case diagnostic, not measured workload sufficiency or canonical evidence admission. Stream limits retain their separate shared subprocess-policy owner.",
    "reuse": false,
    "may_skip_tests": false,
    "fresh_native_baseline": false,
    "canonical_profile_reuse_enabled": false
  },
  "defaults": {
    "undeclared_step": "global_source_fingerprint_execute",
    "unknown_source_layer": "global_source_fingerprint_execute",
    "missing_input": "global_source_fingerprint_execute",
    "unresolved_local_import": "global_source_fingerprint_execute",
    "dynamic_import_risk": "global_source_fingerprint_execute"
  },
  "validation": {
    "required_dispositions": [
      "semantic_closure_reviewed",
      "same_invocation_shared_producer",
      "always_fresh",
      "global_source_fingerprint_until_mapped"
    ],
    "reviewed_semantic_step_ids": [
      "source_layer_classification_policy_validation"
    ],
    "require_exact_step_partition": true,
    "engine_test_sharding_status": "deterministic_exact_union_proof_family_steps_active_global_reuse_disabled",
    "engine_test_aggregate_step_id": "engine_contract_tests",
    "engine_test_shard_step_ids": [
      "engine_contract_tests_target_agent",
      "engine_contract_tests_analysis_engines",
      "engine_contract_tests_runtime_platform",
      "engine_contract_tests_governance_policy",
      "engine_contract_tests_release_distribution"
    ]
  },
  "semantic_reuse_engine_paths": [
    "tools/core/release_proof_resume.py",
    "tools/run_release_proof_bundle.py",
    "tools/core/release_validation_dependencies.py",
    "config/release_validation_dependency_contract.json",
    "config/schemas/release_validation_dependency_contract.schema.json"
  ],
  "step_dispositions": {
    "semantic_closure_reviewed": [
      "source_layer_classification_policy_validation"
    ],
    "same_invocation_shared_producer": [
      "release_clone_context_refresh",
      "release_quality_gate_refresh"
    ],
    "always_fresh": [
      "agent_harness_readiness",
      "agent_surface_manual_seal_pack",
      "ai_agent_readiness",
      "artifact_contracts",
      "artifact_provenance_index",
      "artifact_registry_validation",
      "claim_guard",
      "cli_command_contract",
      "contribution_trust_foundation",
      "decision_domain_classification",
      "distribution_hardening",
      "entrypoint_failure_drills",
      "final_consistency",
      "final_suspicion_audit",
      "final_suspicion_audit_validation",
      "hitl_approval_ledger",
      "hitl_decision_requests",
      "hitl_governance",
      "hitl_lifecycle_smoke",
      "installation_contract",
      "installation_proof_smoke",
      "layer_release_matrix",
      "naming_transition_registry",
      "nexora_agent_contract",
      "nexora_agent_handoff",
      "nexora_agent_response",
      "nexora_agent_response_ledger",
      "nexora_brief",
      "nexora_operator_packet",
      "nexora_surface_inventory",
      "operational_parity",
      "pipeline_layer_chain_integrity",
      "product_boundary_map",
      "product_reports",
      "release_artifact_registry_alignment",
      "release_claim_profiles",
      "release_identity",
      "release_language",
      "release_readiness",
      "release_seal_remaining_actions",
      "release_seal_remaining_actions_validation",
      "report_freshness_index",
      "seal_impact_validation",
      "system_connectivity_map",
      "system_connectivity_map_validation",
      "system_health_check",
      "system_health_check_validation",
      "system_spine_registry",
      "text_surface_integrity"
    ],
    "global_source_fingerprint_until_mapped": [
      "actor_interaction_contract",
      "adapter_registry",
      "agent_context_payloads",
      "agent_packet_chain_integrity",
      "agent_semantic_contract_smoke",
      "agent_surface_quality_review",
      "agent_surface_seal_matrix",
      "agent_surface_snippet_range_validation",
      "agent_surface_source_grounding",
      "architecture_oracle",
      "artifact_freshness_contract",
      "atlas_genome_audit_integrity",
      "atlas_sqlite_first_access",
      "audit_lesson_registry_validation",
      "cage_mvp_contracts",
      "capability_activation_plan",
      "capability_activation_plan_validation",
      "capability_pipeline_graph",
      "capability_registry",
      "capability_registry_validation",
      "capability_roadmap",
      "central_decision_contracts",
      "contextos_contracts",
      "contextos_signals",
      "data_lineage_contract",
      "dead_code_language_agnostic_core",
      "dead_code_public_contracts",
      "derived_graph_integrity",
      "derived_layer_contract_coverage_validation",
      "discovery_universality",
      "doctrine_audit_quality_integrity",
      "doctrine_rule_lineage_contract",
      "engine_contract_tests",
      "engine_contract_tests_analysis_engines",
      "engine_contract_tests_governance_policy",
      "engine_contract_tests_release_distribution",
      "engine_contract_tests_runtime_platform",
      "engine_contract_tests_target_agent",
      "engine_data_access",
      "engine_governance_input_lineage",
      "engine_signal_contracts",
      "engine_source_content_boundaries",
      "exception_honesty",
      "external_polyglot_smoke",
      "external_react_smoke",
      "external_repository_evaluation_contract",
      "external_target_agent_surface",
      "external_target_retention",
      "fixture_isolation",
      "fractal_sqlite_first_access",
      "genome_sqlite_first_access",
      "governance_registry_validation",
      "governance_trace_contract",
      "hardcoded_decision_inventory",
      "language_agnostic_symbols",
      "large_artifact_sqlite_first_access",
      "layer_import_boundary",
      "manual_adversarial_audit_checklist_validation",
      "manual_adversarial_audit_progress_validation",
      "manual_validator_execution_plan",
      "mcp_agent_surface",
      "mcp_surface_command_matrix",
      "merge_intelligence_regression",
      "modular_doctrine_registry",
      "next_boundary_policy_core",
      "non_python_decision_inventory",
      "oracle_doctrine_hitl_integrity",
      "performance_budget",
      "performance_ledger",
      "performance_profile_integrity",
      "pipeline_execution_contract",
      "plugin_manifest_contract",
      "polyglot_capabilities",
      "principle_pack_contracts",
      "project_dna_profile",
      "project_dna_profile_validation",
      "quality_gate_policy_core",
      "react_analysis_chain_integrity",
      "react_corpus_saturation",
      "react_corpus_semantic_audit",
      "react_ecosystem_policy_core",
      "react_edge_cases",
      "react_fixture_family_taxonomy",
      "react_fixtures",
      "react_frontier_policy_core",
      "react_immutability_purity_cage",
      "react_immutability_purity_cage_validation",
      "react_runtime_policy_core",